{
  "schemaVersion": "1.0",
  "generatedAt": "2026-09-24T09:46:03.4380099+00:00",
  "subject": {
    "repository": "simplexidev/codex-toolkit",
    "revision": "5a4b35e5ccd96392e91a11c4048c4497cdcee655"
  },
  "scenarios": {
    "total": 17,
    "passed": 17
  },
  "metrics": [
    {
      "name": "scenario-pass-rate",
      "value": 1,
      "unit": "ratio",
      "direction": "higher-is-better",
      "kind": "measured",
      "method": "optimized v2 scenarios passing the final quality gate"
    },
    {
      "name": "regression-count",
      "value": 0,
      "unit": "count",
      "direction": "lower-is-better",
      "kind": "derived",
      "method": "optimized failures above the reviewed pre-v2 baseline failure count"
    },
    {
      "name": "model-policy-compliance",
      "value": 1,
      "unit": "ratio",
      "direction": "higher-is-better",
      "kind": "derived",
      "method": "validated OpenAI executor identities and deterministic judge path"
    },
    {
      "name": "acceptance-scenario-coverage",
      "value": 1,
      "unit": "ratio",
      "direction": "higher-is-better",
      "kind": "derived",
      "method": "completed optimized records divided by the bounded acceptance plan"
    },
    {
      "name": "capability-coverage",
      "value": 0.5484,
      "unit": "ratio",
      "direction": "higher-is-better",
      "kind": "derived",
      "method": "bounded optimized scenarios divided by 31 declared v2 capability groups"
    },
    {
      "name": "pre-v2-scenario-pass-rate",
      "value": 0.8824,
      "unit": "ratio",
      "direction": "higher-is-better",
      "kind": "measured",
      "method": "reviewed pre-v2 baseline"
    },
    {
      "name": "vanilla-skill-pass-rate",
      "value": 0.9286,
      "unit": "ratio",
      "direction": "higher-is-better",
      "kind": "measured",
      "method": "reviewed VANILLA baseline"
    },
    {
      "name": "upstream-skill-pass-rate",
      "value": 0.9286,
      "unit": "ratio",
      "direction": "higher-is-better",
      "kind": "measured",
      "method": "reviewed UPSTREAM baseline"
    },
    {
      "name": "optimized-skill-pass-rate",
      "value": 1,
      "unit": "ratio",
      "direction": "higher-is-better",
      "kind": "measured",
      "method": "optimized capability records passing the final quality gate"
    },
    {
      "name": "optimized-agent-pass-rate",
      "value": 1,
      "unit": "ratio",
      "direction": "higher-is-better",
      "kind": "measured",
      "method": "optimized agent-boundary records passing the final quality gate"
    },
    {
      "name": "deterministic-resolution-rate",
      "value": 1,
      "unit": "ratio",
      "direction": "higher-is-better",
      "kind": "derived",
      "method": "records resolved by deterministic assertions without a semantic judge"
    },
    {
      "name": "jev-remote-calls",
      "value": 0,
      "unit": "calls",
      "direction": "lower-is-better",
      "kind": "measured",
      "method": "instrumented remote JEV judge calls"
    },
    {
      "name": "jev-fallbacks",
      "value": 0,
      "unit": "count",
      "direction": "lower-is-better",
      "kind": "measured",
      "method": "instrumented JEV fallbacks"
    },
    {
      "name": "jev-escalations",
      "value": 0,
      "unit": "count",
      "direction": "lower-is-better",
      "kind": "measured",
      "method": "instrumented JEV-to-GPT escalations"
    },
    {
      "name": "jev-false-exclusion-coverage",
      "value": 0,
      "unit": "ratio",
      "direction": "higher-is-better",
      "kind": "derived",
      "method": "records with calibrated false-exclusion evidence"
    },
    {
      "name": "jev-context-avoided-coverage",
      "value": 0,
      "unit": "ratio",
      "direction": "higher-is-better",
      "kind": "derived",
      "method": "records with measured avoided-context evidence"
    },
    {
      "name": "optimized-mean-total-tokens",
      "value": 43500.8824,
      "unit": "tokens",
      "direction": "lower-is-better",
      "kind": "derived",
      "method": "arithmetic mean over available optimized records"
    },
    {
      "name": "optimized-mean-elapsed-seconds",
      "value": 20.2524,
      "unit": "seconds",
      "direction": "lower-is-better",
      "kind": "derived",
      "method": "arithmetic mean over available optimized records"
    },
    {
      "name": "optimized-mean-tool-calls",
      "value": 0,
      "unit": "count",
      "direction": "neutral",
      "kind": "derived",
      "method": "arithmetic mean over available optimized records"
    },
    {
      "name": "optimized-skill-mean-total-tokens",
      "value": 45626,
      "unit": "tokens",
      "direction": "lower-is-better",
      "kind": "derived",
      "method": "arithmetic mean over available optimized records"
    },
    {
      "name": "optimized-skill-mean-elapsed-seconds",
      "value": 21.0897,
      "unit": "seconds",
      "direction": "lower-is-better",
      "kind": "derived",
      "method": "arithmetic mean over available optimized records"
    },
    {
      "name": "optimized-agent-mean-total-tokens",
      "value": 33583.6667,
      "unit": "tokens",
      "direction": "lower-is-better",
      "kind": "derived",
      "method": "arithmetic mean over available optimized records"
    },
    {
      "name": "optimized-agent-mean-elapsed-seconds",
      "value": 16.3447,
      "unit": "seconds",
      "direction": "lower-is-better",
      "kind": "derived",
      "method": "arithmetic mean over available optimized records"
    }
  ],
  "provenance": {
    "sourceRuns": 17,
    "sanitized": true,
    "approval": "reviewed"
  }
}
