{
  "schemaVersion": "1.0",
  "generatedAt": "2026-09-23T03:47:17+00:00",
  "subject": {
    "repository": "simplexidev/codex-toolkit",
    "revision": "771f6513b938aceca2f88c59cbd9a3bfbcb39ff9"
  },
  "scenarios": {
    "total": 17,
    "passed": 15
  },
  "metrics": [
    {
      "name": "scenario-pass-rate",
      "value": 0.8824,
      "unit": "ratio",
      "direction": "higher-is-better",
      "kind": "derived",
      "method": "scenarios passing across every evaluated arm"
    },
    {
      "name": "agents-builtin-pass-rate",
      "value": 1,
      "unit": "ratio",
      "direction": "higher-is-better",
      "kind": "measured",
      "method": "passing reviewed records divided by records for this arm"
    },
    {
      "name": "agents-builtin-mean-total-tokens",
      "value": 81911,
      "unit": "tokens",
      "direction": "lower-is-better",
      "kind": "derived",
      "method": "Codex JSONL usage averaged over available records"
    },
    {
      "name": "agents-builtin-mean-elapsed-seconds",
      "value": 22.9116,
      "unit": "seconds",
      "direction": "lower-is-better",
      "kind": "derived",
      "method": "monotonic elapsed time averaged over reviewed records"
    },
    {
      "name": "agents-builtin-mean-tool-calls",
      "value": 0,
      "unit": "count",
      "direction": "neutral",
      "kind": "derived",
      "method": "structured tool-call observations averaged over available records"
    },
    {
      "name": "agents-builtin-delegation-rate",
      "value": 0,
      "unit": "ratio",
      "direction": "neutral",
      "kind": "derived",
      "method": "records with observed subagents divided by records for this arm"
    },
    {
      "name": "agents-current-custom-pass-rate",
      "value": 1,
      "unit": "ratio",
      "direction": "higher-is-better",
      "kind": "measured",
      "method": "passing reviewed records divided by records for this arm"
    },
    {
      "name": "agents-current-custom-mean-total-tokens",
      "value": 67368,
      "unit": "tokens",
      "direction": "lower-is-better",
      "kind": "derived",
      "method": "Codex JSONL usage averaged over available records"
    },
    {
      "name": "agents-current-custom-mean-elapsed-seconds",
      "value": 18.6878,
      "unit": "seconds",
      "direction": "lower-is-better",
      "kind": "derived",
      "method": "monotonic elapsed time averaged over reviewed records"
    },
    {
      "name": "agents-current-custom-mean-tool-calls",
      "value": 0,
      "unit": "count",
      "direction": "neutral",
      "kind": "derived",
      "method": "structured tool-call observations averaged over available records"
    },
    {
      "name": "agents-current-custom-delegation-rate",
      "value": 0,
      "unit": "ratio",
      "direction": "neutral",
      "kind": "derived",
      "method": "records with observed subagents divided by records for this arm"
    },
    {
      "name": "dotnet-upstream-pass-rate",
      "value": 0.9286,
      "unit": "ratio",
      "direction": "higher-is-better",
      "kind": "measured",
      "method": "passing reviewed records divided by records for this arm"
    },
    {
      "name": "dotnet-upstream-mean-total-tokens",
      "value": 53221.6429,
      "unit": "tokens",
      "direction": "lower-is-better",
      "kind": "derived",
      "method": "Codex JSONL usage averaged over available records"
    },
    {
      "name": "dotnet-upstream-mean-elapsed-seconds",
      "value": 18.7202,
      "unit": "seconds",
      "direction": "lower-is-better",
      "kind": "derived",
      "method": "monotonic elapsed time averaged over reviewed records"
    },
    {
      "name": "dotnet-upstream-mean-tool-calls",
      "value": 0,
      "unit": "count",
      "direction": "neutral",
      "kind": "derived",
      "method": "structured tool-call observations averaged over available records"
    },
    {
      "name": "dotnet-upstream-delegation-rate",
      "value": 0,
      "unit": "ratio",
      "direction": "neutral",
      "kind": "derived",
      "method": "records with observed subagents divided by records for this arm"
    },
    {
      "name": "dotnet-vanilla-pass-rate",
      "value": 0.9286,
      "unit": "ratio",
      "direction": "higher-is-better",
      "kind": "measured",
      "method": "passing reviewed records divided by records for this arm"
    },
    {
      "name": "dotnet-vanilla-mean-total-tokens",
      "value": 38991.2857,
      "unit": "tokens",
      "direction": "lower-is-better",
      "kind": "derived",
      "method": "Codex JSONL usage averaged over available records"
    },
    {
      "name": "dotnet-vanilla-mean-elapsed-seconds",
      "value": 16.4902,
      "unit": "seconds",
      "direction": "lower-is-better",
      "kind": "derived",
      "method": "monotonic elapsed time averaged over reviewed records"
    },
    {
      "name": "dotnet-vanilla-mean-tool-calls",
      "value": 0,
      "unit": "count",
      "direction": "neutral",
      "kind": "derived",
      "method": "structured tool-call observations averaged over available records"
    },
    {
      "name": "dotnet-vanilla-delegation-rate",
      "value": 0,
      "unit": "ratio",
      "direction": "neutral",
      "kind": "derived",
      "method": "records with observed subagents divided by records for this arm"
    }
  ],
  "provenance": {
    "sourceRuns": 34,
    "sanitized": true,
    "approval": "reviewed"
  }
}
